{
  "contract": "delivery-receipt",
  "contract_version": 1,
  "issuer": "discord-relay",
  "audience": "nexus",
  "key_scope": "discord-relay->nexus",
  "connection_id": "11111111-2222-4333-8444-555555555555",
  "app_id": "123456789012345678",
  "guild_id": "223456789012345678",
  "generation": 7,
  "key_id": "relay-current-2026-01",
  "batch_id": "88888888-9999-4888-8999-000000000000",
  "receipt_id": "bbbbbbbb-cccc-4ddd-8eee-ffffffffffff",
  "idempotency_key": "cccccccc-dddd-4eee-8fff-000000000000",
  "lease_token": "lease_2026_08_08_120000_abc123",
  "state": "partial",
  "received_at": "2026-08-08T12:01:30Z",
  "items": [
    {
      "delivery_id": "99999999-aaaa-4999-8aaa-bbbbbbbbbbbb",
      "dedupe_key": "delivery:war-alert:001",
      "state": "delivered",
      "processed_at": "2026-08-08T12:00:10Z",
      "discord_message_id": "523456789012345678"
    },
    {
      "delivery_id": "aaaaaaaa-bbbb-4ccc-8ddd-eeeeeeeeeeee",
      "dedupe_key": "delivery:private-notification:002",
      "state": "retryable",
      "processed_at": "2026-08-08T12:01:20Z",
      "error_code": "discord_unavailable",
      "error_message": "Discord API unavailable",
      "retry_after_seconds": 30
    }
  ],
  "signature": {
    "algorithm": "ed25519",
    "value": "7c7bc02ebca4c2c74c407481be04e982845984c6d13f286176c241cca4418620332692e716ba55a49064cd73633bd127caf0f48e665e97c56c0751fe28785901"
  }
}
